<xs:schema attributeFormDefault="unqualified" elementFormDefault="qualified" xmlns:xs="http://www.w3.org/2001/XMLSchema">
  <xs:element name="dinolist">
    <xs:complexType>
      <xs:sequence>
        <xs:element name="dinosaur" maxOccurs="unbounded" minOccurs="0">
          <xs:complexType>
            <xs:sequence>
              <xs:element type="xs:string" name="name"/>
              <xs:element type="xs:string" name="group"/>
              <xs:element name="range">
                <xs:complexType>
                  <xs:sequence>
                    <xs:element type="xs:string" name="region" maxOccurs="unbounded" minOccurs="0"/>
                  </xs:sequence>
                </xs:complexType>
              </xs:element>
              <xs:element name="physio">
                <xs:complexType>
                  <xs:sequence>
                    <xs:element name="length">
                      <xs:complexType>
                        <xs:simpleContent>
                          <xs:extension base="xs:byte">
                            <xs:attribute type="xs:string" name="unit" use="optional"/>
                          </xs:extension>
                        </xs:simpleContent>
                      </xs:complexType>
                    </xs:element>
                    <xs:element name="weight">
                      <xs:complexType>
                        <xs:simpleContent>
                          <xs:extension base="xs:float">
                            <xs:attribute type="xs:string" name="unit" use="optional"/>
                          </xs:extension>
                        </xs:simpleContent>
                      </xs:complexType>
                    </xs:element>
                    <xs:element type="xs:string" name="diet"/>
                  </xs:sequence>
                </xs:complexType>
              </xs:element>
            </xs:sequence>
            <xs:attribute type="xs:string" name="period" use="optional"/>
          </xs:complexType>
        </xs:element>
      </xs:sequence>
    </xs:complexType>
  </xs:element>
</xs:schema>